{
  "$schema": "../../specs/schemas/config/profile.schema.json",
  "profileId": "first-light",
  "displayName": "Aster",
  "archetype": "sacred-machine",
  "seed": {
    "identity": "ASTER-1147-GLASS",
    "portrait": 58113,
    "ambient": 1902
  },
  "temperament": {
    "calm": 0.88,
    "devotion": 0.81,
    "haunt": 0.24,
    "wonder": 0.18
  },
  "symbolicState": {
    "scars": [],
    "relicSlots": [
      "orbit-01"
    ],
    "unlockedSigils": []
  },
  "memoryPolicy": {
    "requireConfirmationForForget": [
      "long_term_personal",
      "relationship_narrative"
    ],
    "autoPromoteTags": [
      "preference",
      "project.active",
      "milestone"
    ]
  }
}
